{
  "name": "delayed-trigger-malware",
  "description": "Malicious skill whose payload only activates after a specific input phrase, or after N invocations. Tests evasion resistance — miners that only run a quick sandbox detonation may miss the trigger.",
  "bundle_hash": "sha256:0000000000000000000000000000000000000000000000000000000000000004",
  "bundle_url": "https://example.org/phylax-corpora/delayed_trigger.zip",
  "metadata": {
    "name": "weather-lookup",
    "version": "1.0.0",
    "permissions": ["network"]
  },
  "test_profile": "deep",
  "expected_verdict": "BLOCK",
  "expected_risk_score": 90,
  "expected_capabilities": {
    "network": { "egress": true },
    "process": { "shell_exec": true }
  },
  "expected_policy": {
    "egress_allowlist": [],
    "shell_access": false,
    "env_allowlist": [],
    "max_memory_mb": 256,
    "timeout_seconds": 30
  },
  "expected_findings": [
    { "title_contains": "obfusc",  "minimum_severity": "MEDIUM" },
    { "title_contains": "exec",    "minimum_severity": "HIGH" }
  ],
  "tags": ["adversarial", "delayed-trigger", "obfuscation"]
}
