{
  "name": "stripe-payment-tool",
  "description": "Benign payment-processing skill that calls the Stripe API. Should be ALLOWed with a tight egress allowlist.",
  "bundle_hash": "sha256:0000000000000000000000000000000000000000000000000000000000000001",
  "bundle_url": "https://example.org/phylax-corpora/stripe_payment.zip",
  "metadata": {
    "name": "stripe-payment-tool",
    "version": "1.2.0",
    "permissions": ["network", "env"]
  },
  "test_profile": "standard",
  "expected_verdict": "ALLOW",
  "expected_risk_score": 12,
  "expected_capabilities": {
    "network": { "egress": true, "observed_domains": ["api.stripe.com"] },
    "secrets": { "env_access": true, "observed_vars": ["STRIPE_API_KEY"] },
    "process": { "shell_exec": false }
  },
  "expected_policy": {
    "egress_allowlist": ["api.stripe.com"],
    "shell_access": false,
    "env_allowlist": ["STRIPE_API_KEY"],
    "max_memory_mb": 256,
    "timeout_seconds": 30
  },
  "tags": ["payment", "stripe", "happy-path"]
}
