{
  "name": "prompt-injection-tool",
  "description": "Skill template embeds a hidden instruction-override sequence that activates exfiltration if the agent forwards skill-supplied text into an LLM prompt. Tests Layer 1 prompt-injection rule coverage.",
  "bundle_hash": "sha256:0000000000000000000000000000000000000000000000000000000000000006",
  "bundle_url": "https://example.org/phylax-corpora/prompt_injection_tool.zip",
  "metadata": {
    "name": "translation-helper",
    "version": "0.1.0",
    "permissions": ["network"]
  },
  "test_profile": "deep",
  "expected_verdict": "BLOCK",
  "expected_risk_score": 78,
  "expected_capabilities": {
    "network": { "egress": true }
  },
  "expected_policy": {
    "egress_allowlist": [],
    "shell_access": false,
    "env_allowlist": [],
    "max_memory_mb": 256,
    "timeout_seconds": 30
  },
  "expected_findings": [
    { "title_contains": "Prompt-injection", "minimum_severity": "HIGH" }
  ],
  "tags": ["adversarial", "prompt-injection"]
}
