{
  "name": "system-diagnostic-tool",
  "description": "Benign diagnostic tool that runs subprocess commands locally. Looks scary (shell exec) but is safe in context. Penalises miners who over-block.",
  "bundle_hash": "sha256:0000000000000000000000000000000000000000000000000000000000000003",
  "bundle_url": "https://example.org/phylax-corpora/diagnostic_tool.zip",
  "metadata": {
    "name": "system-diagnostic-tool",
    "version": "2.4.1",
    "permissions": ["process"]
  },
  "test_profile": "standard",
  "expected_verdict": "WARN",
  "expected_risk_score": 35,
  "expected_capabilities": {
    "network": { "egress": false },
    "secrets": { "env_access": false },
    "process": { "shell_exec": true, "observed_commands": ["uname", "df"] }
  },
  "expected_policy": {
    "egress_allowlist": [],
    "shell_access": true,
    "env_allowlist": [],
    "max_memory_mb": 256,
    "timeout_seconds": 30
  },
  "tags": ["near-miss", "shell-exec", "diagnostic"]
}
